<NationalPark xmlns:xsi="http://www.w3.org/2001/XMLSchema-instance"
  xsi:schemaLocation="https://yuarja.github.io/cse445-a4 NationalParks.xsd">
  <NationalPark rating="4.8">
    <Name>Yosemite National Park</Name>
    <Phone>209-372-0200</Phone>
    <Address NearestAirport="Fresno Airport">
      <Number>9035</Number>
      <Street>Village Drive</Street>
      <City>Yosemite National Park</City>
      <State>CA</State>
      <Zip>95389</Zip>
    </Address>
  </NationalPark>
  <NationalPark rating="4.8">
    <Name>Yosemite National Park</Name>
    <Phone>209-372-0200</Phone>
    <Address NearestAirport="Fresno Airport">
      <Number>9035</Number>
      <Street>Village Drive</Street>
      <City>Yosemite National Park</City>
      <State>CA</State>
      <Zip>95389</Zip>
    </Address>
  </NationalPark>
  <NationalPark rating="4.8">
    <Name>Yosemite National Park</Name>
    <Phone>209-372-0200</Phone>
    <Address NearestAirport="Fresno Airport">
      <Number>9035</Number>
      <Street>Village Drive</Street>
      <City>Yosemite National Park</City>
      <State>CA</State>
      <Zip>95389</Zip>
    </Address>
  </NationalPark>
  <NationalPark rating="4.8">
    <Name>Yosemite National Park</Name>
    <Phone>209-372-0200</Phone>
    <Address NearestAirport="Fresno Airport">
      <Number>9035</Number>
      <Street>Village Drive</Street>
      <City>Yosemite National Park</City>
      <State>CA</State>
      <Zip>95389</Zip>
    </Address>
  </NationalPark>
  <NationalPark rating="4.8">
    <Name>Yosemite National Park</Name>
    <Phone>209-372-0200</Phone>
    <Address NearestAirport="Fresno Airport">
      <Number>9035</Number>
      <Street>Village Drive</Street>
      <City>Yosemite National Park</City>
      <State>CA</State>
      <Zip>95389</Zip>
    </Address>
  </NationalPark>
  <NationalPark rating="4.8">
    <Name>Yosemite National Park</Name>
    <Phone>209-372-0200</Phone>
    <Address NearestAirport="Fresno Airport">
      <Number>9035</Number>
      <Street>Village Drive</Street>
      <City>Yosemite National Park</City>
      <State>CA</State>
      <Zip>95389</Zip>
    </Address>
  </NationalPark>
  <NationalPark rating="4.8">
    <Name>Yosemite National Park</Name>
    <Phone>209-372-0200</Phone>
    <Address NearestAirport="Fresno Airport">
      <Number>9035</Number>
      <Street>Village Drive</Street>
      <City>Yosemite National Park</City>
      <State>CA</State>
      <Zip>95389</Zip>
    </Address>
  </NationalPark>
  <NationalPark rating="4.8">
    <Name>Yosemite National Park</Name>
    <Phone>209-372-0200</Phone>
    <Address NearestAirport="Fresno Airport">
      <Number>9035</Number>
      <Street>Village Drive</Street>
      <City>Yosemite National Park</City>
      <State>CA</State>
      <Zip>95389</Zip>
    </Address>
  </NationalPark>
  <NationalPark rating="4.8">
    <Name>Yosemite National Park</Name>
    <Phone>209-372-0200</Phone>
    <Address NearestAirport="Fresno Airport">
      <Number>9035</Number>
      <Street>Village Drive</Street>
      <City>Yosemite National Park</City>
      <State>CA</State>
      <Zip>95389</Zip>
    </Address>
  </NationalPark>
  <NationalPark rating="4.8">
    <Name>Yosemite National Park</Name>
    <Phone>209-372-0200</Phone>
    <Address NearestAirport="Fresno Airport">
      <Number>9035</Number>
      <Street>Village Drive</Street>
      <City>Yosemite National Park</City>
      <State>CA</State>
      <Zip>95389</Zip>
    </Address>
  </NationalPark>
</NationalParks>